<?xml version="1.0" encoding="ISO-8859-1"?>
<empresa xmlns:xsi="http://www.w3.org/2001/XMLSchema-instance"  xsi:noNamespaceSchemaLocation="empresa.xsd">
    <datos_empresa telefono="917776688" fax="917776699">
        <nombre>Equipos Digitales S.L.</nombre>
        <dir>Av. Valladolid</dir>
        <poblacion cod_postal="28043">Madrid</poblacion>
        <provincia>Madrid</provincia>
        <cif>Q-9876543</cif>
    </datos_empresa>
    <clientes>
        <cliente n_cli="c1">
            <nombre>Darío, Bueno Gutiérrez</nombre>
            <dir_env>Av. Oporto nº7 4ºd</dir_env>
            <poblacion cod_postal="28043">Madrid</poblacion>
            <provincia>Madrid</provincia>
            <telefono num="600655388"/>
        </cliente>
        <cliente n_cli="c2">
            <nombre>Juan, Lara Ortega</nombre>
            <dir_env>Av. España nº17 6ºc</dir_env>
            <poblacion cod_postal="29680">Estepona</poblacion>
            <provincia>Málaga</provincia>
        </cliente>
    </clientes>
    <factura n_fac="f1" cli="c1">
        <datos_factura n_ped="p1" iva="16" f_pago="tarjeta" moneda="euro">
            <fecha>2016-01-05</fecha>
            <linea>
                <ref>MII93000F/8</ref>
                <desc>MICRO PENTIUM IV 3000MHZ FB800</desc>
                <cant>1</cant>
                <precio>230</precio>
                <importe>266.80</importe>
            </linea>
            <linea>
                <ref>MB8QDIP4</ref>
                <desc>PLACA BASE QDI P4</desc>
                <cant>1</cant>
                <precio>180</precio>
                <importe>208.80</importe>
            </linea>
            <linea>
                <ref>MEDD512M32</ref>
                <desc>DIMM DDR 512MB 3200</desc>
                <cant>2</cant>
                <precio>40</precio>
                <importe>92.80</importe>
            </linea>
            <linea>
                <ref>HD250GSA7</ref>
                <desc>DISCO DURO 250GB S-ATA 7200</desc>
                <cant>4</cant>
                <precio>120</precio>
                <importe>556.80</importe>
            </linea>
            <base>970.00</base>
            <cuota_iva>155.20</cuota_iva>
            <total>1125.20</total>
        </datos_factura>
    </factura>
    <factura n_fac="f2" cli="c2">
        <datos_factura n_ped="p4" iva="16" f_pago="efectivo" moneda="euro">
            <fecha>2016-01-17</fecha>
            <linea>
                <ref>MII93000F/8</ref>
                <desc>MICRO PENTIUM IV 3000MHZ FB800</desc>
                <cant>2</cant>
                <precio>230</precio>
                <importe>266.80</importe>
            </linea>
            <base>460.00</base>
            <cuota_iva>73.60</cuota_iva>
            <total>533.60</total>
        </datos_factura>
    </factura>
</empresa>